{
  "schemaVersion": "1.0.0",
  "taskId": "SUT-AIOS-GOV-057",
  "baseSha": "76f42c6b0d7a292fb1bb251c088c6e3e9db0f6ce",
  "headSha": "c89ef28ed10d33723baf7072bfaefe545c2cfa2c",
  "reviewerAgent": "engineering-planner",
  "model": "gpt-5.6-sol",
  "reasoningEffort": "high",
  "contextManifestHash": "41354e8510d63fa2ec480c9147ea44c00b50594d9ddd51420e5ee892ebeedf36",
  "reviewedAt": "2026-08-12T20:19:52.042Z",
  "stage": "planReview",
  "runId": "20260812201934097-6642b446",
  "tracePath": "evidence/reviews/SUT-AIOS-GOV-057/traces/20260812201934097-6642b446-engineering-planner-sol.jsonl",
  "outputHash": "d6df10e83af6f563b6007ad0d195b89dc09469bf4497e3eb7674a24958225f88",
  "decision": "pass",
  "blockingFindings": [],
  "nonBlockingRisks": [
    "The task-local context budget is close to the repository ceiling, so additional durable same-task review history could exhaust the budget even without implementation-scope growth.",
    "scripts/codex/launch.mjs remains a broad orchestration module combining routing, context construction, process control, evidence validation, and publication; this repair is bounded, but future changes may become harder to reason about independently."
  ],
  "missingNegativeTests": [],
  "architectureAssessment": {
    "deepModules": "The plan keeps the repair within the existing launcher, lifecycle validator, review-result validator, schemas, focused tests, and task-bound evidence surfaces; responsibilities are explicit and no product-runtime or unrelated-task authority is introduced.",
    "hexagonalArchitecture": "The planned changes remain at repository orchestration boundaries around the Codex child process, Git revision resolution, filesystem evidence, and validation adapters, without granting the model or launcher production, provider, deployment, database, payment, or policy authority.",
    "eventedBoundaries": "The plan defines testable ordered progress and terminal events for launch, bounded output, success, failure, cancellation, and persistence, with fail-closed rules that prevent a review result from existing without valid terminal provenance."
  },
  "exactNextAction": "Persist this SHA-bound planReview result for c89ef28ed10d33723baf7072bfaefe545c2cfa2c, then run the independently routed semanticReview on the same immutable source head and canonical base."
}
