{
  "schemaVersion": "1.0.0",
  "taskId": "SUT-AIOS-GOV-057",
  "baseSha": "76f42c6b0d7a292fb1bb251c088c6e3e9db0f6ce",
  "headSha": "6a7f41039e24184bc9ec286f9719ff2a5dc26b54",
  "reviewerAgent": "engineering-planner",
  "model": "gpt-5.6-sol",
  "reasoningEffort": "high",
  "contextManifestHash": "3c2df02ef8567b765f82f884ad916763a9915ef6d17d44f2684c7ebb0f391158",
  "reviewedAt": "2026-08-13T02:45:39.180Z",
  "stage": "planReview",
  "runId": "20260813024505029-0aa963f3",
  "tracePath": "evidence/reviews/SUT-AIOS-GOV-057/traces/20260813024505029-0aa963f3-engineering-planner-sol.jsonl",
  "outputHash": "ae01ce25097fa236d6344ca4bb79884663e98e85de34af3719e2b6bf9639ca3e",
  "decision": "pass",
  "blockingFindings": [],
  "nonBlockingRisks": [
    "TASK_WORKFLOW.md generically directs large traces to artifacts/, while the more specific Workflow V2 contract requires bound review traces under evidence/reviews/<task-id>/traces/; the specific rule is enforceable, but the generic wording could confuse operators.",
    "The repair concentrates process control, context construction, evidence sequencing, and publication logic in launch.mjs, increasing maintenance risk despite the bounded packet and focused regression suites."
  ],
  "missingNegativeTests": [],
  "architectureAssessment": {
    "deepModules": "The plan is bounded to the review orchestration, validation, lifecycle, documentation, and same-task evidence surfaces; its acceptance criteria expose deterministic contracts for cancellation, output bounds, context binding, and publication rather than widening product behavior.",
    "hexagonalArchitecture": "Provider execution remains behind the existing Codex child-process adapter, while task policy, review validation, evidence sequencing, and atomic persistence remain repository-owned boundaries with no provider fallback or production authority.",
    "eventedBoundaries": "The JSONL progress contract explicitly covers launch, bounded child-output milestones, completion, failure, and cancellation, with singular ordered terminal events and fail-closed persistence gates."
  },
  "exactNextAction": "Persist this SHA-bound passing planReview result, then run semanticReview on the same immutable head 6a7f41039e24184bc9ec286f9719ff2a5dc26b54 using the packet-authorized qa-verification Luna/high route without modifying implementation or task scope."
}
