{
  "schemaVersion": "1.0.0",
  "taskId": "SUT-AIOS-GOV-057",
  "baseSha": "76f42c6b0d7a292fb1bb251c088c6e3e9db0f6ce",
  "headSha": "06b1e3d6d2476a9140e2265ff68460c1de396d9d",
  "reviewerAgent": "engineering-planner",
  "model": "gpt-5.6-sol",
  "reasoningEffort": "high",
  "contextManifestHash": "d865fd4094620b367c4fcc36d0e7be0dd8c3c1551064e18fca60980132f0ee23",
  "reviewedAt": "2026-08-13T03:30:35.249Z",
  "stage": "planReview",
  "runId": "20260813033017771-eabef4c0",
  "tracePath": "evidence/reviews/SUT-AIOS-GOV-057/traces/20260813033017771-eabef4c0-engineering-planner-sol.jsonl",
  "outputHash": "53c973ce1540c02b77b3e03139e4873ed03d0fab111f0614c7cc202398db6058",
  "decision": "pass",
  "blockingFindings": [],
  "nonBlockingRisks": [
    "The 458752-byte task-local context cap leaves limited headroom below the repository ceiling as durable same-task review history grows; later stages must continue to fail closed on overflow without widening context or authority.",
    "The repair changes high-risk governance and evidence-admission boundaries, so passing plan review does not substitute for the packet-required independent semantic and merge-risk reviews against this exact source head."
  ],
  "missingNegativeTests": [],
  "architectureAssessment": {
    "deepModules": "The plan keeps review orchestration, trace validation, lifecycle verification, and schema enforcement within existing governance modules and exposes narrow deterministic contracts rather than distributing policy across unrelated product surfaces.",
    "hexagonalArchitecture": "Provider execution remains behind the existing Codex launcher boundary; packet authority, canonical Git revisions, validation, persistence, and local process control remain repository-owned concerns with no fallback or production adapter expansion.",
    "eventedBoundaries": "Structured start, progress, review-bound, success, failure, and cancellation events have explicit ordering, bounded payloads, terminal-state invariants, and fail-closed persistence rules, with platform-specific cancellation behavior covered by deterministic negatives."
  },
  "exactNextAction": "Persist this passing planReview assessment bound to source head 06b1e3d6d2476a9140e2265ff68460c1de396d9d, then run the packet-authorized semanticReview against the same immutable head and canonical base."
}
