{
  "schemaVersion": "1.0.0",
  "taskId": "SUT-AIOS-GOV-057",
  "baseSha": "76f42c6b0d7a292fb1bb251c088c6e3e9db0f6ce",
  "headSha": "cbd73cad09c73e4e84dfbf2294dd2ea2084c6898",
  "reviewerAgent": "engineering-planner",
  "model": "gpt-5.6-sol",
  "reasoningEffort": "high",
  "contextManifestHash": "19e1a6c4e34a1792783829ac41738bf5ddcc944c379cbf4c655bfdad23549ac7",
  "reviewedAt": "2026-08-13T03:18:47.237Z",
  "stage": "planReview",
  "runId": "20260813031829816-69f2d4f7",
  "tracePath": "evidence/reviews/SUT-AIOS-GOV-057/traces/20260813031829816-69f2d4f7-engineering-planner-sol.jsonl",
  "outputHash": "7e36ab3e00fb6d3357e7eec74329bad0229ec86d419dc5ccc970b9d0bec1c528",
  "decision": "pass",
  "blockingFindings": [],
  "nonBlockingRisks": [
    "The unusually large task history and broad same-task evidence allowlists increase review-context and audit complexity, so later stages must continue enforcing exact changed-path, context-budget, and append-only evidence constraints."
  ],
  "missingNegativeTests": [],
  "architectureAssessment": {
    "deepModules": "The plan keeps review prompting, output validation, trace handling, persistence, and lifecycle verification inside existing governance modules with explicit invariants and packet-bounded paths.",
    "hexagonalArchitecture": "The repair preserves the launcher and Codex-app adapters as orchestration boundaries while keeping routing policy, schema validation, canonical Git state, and evidence admission independently authoritative.",
    "eventedBoundaries": "Structured start, progress, binding, terminal, cancellation, and failure events are explicitly bounded, ordered, redacted, and required to fail closed before review-result publication."
  },
  "exactNextAction": "Proceed with the packet-authorized semanticReview on immutable head cbd73cad09c73e4e84dfbf2294dd2ea2084c6898, using the exact-head verification record and without modifying the governed source head."
}
