{
  "schemaVersion": "1.0.0",
  "taskId": "SUT-AIOS-GOV-057",
  "baseSha": "76f42c6b0d7a292fb1bb251c088c6e3e9db0f6ce",
  "headSha": "3d2b577cbb6109d73a2fcf5c1edd9f4c8c3649b7",
  "reviewerAgent": "qa-verification",
  "model": "gpt-5.6-luna",
  "reasoningEffort": "high",
  "contextManifestHash": "a513787d82de9b8d6a28e741361cab7ed382e0e07b3918023e305b7318eae93a",
  "reviewedAt": "2026-08-09T09:34:55.164Z",
  "stage": "semanticReview",
  "runId": "20260809093356714-899d763e",
  "tracePath": "artifacts/traces/codex-routing/SUT-AIOS-GOV-057/20260809093356714-899d763e-qa-verification-luna.jsonl",
  "outputHash": "453306897a4bb90fe32a8dc1aa6fcb019063e9da89aadac46fed18274c42f900",
  "decision": "pass",
  "blockingFindings": [],
  "nonBlockingRisks": [],
  "missingNegativeTests": [],
  "architectureAssessment": {
    "deepModules": "Review orchestration, assessment parsing, cancellation, and persistence are separated into bounded responsibilities.",
    "hexagonalArchitecture": "Provider execution remains behind the existing Codex CLI boundary; routing and persistence authority stay in the launcher.",
    "eventedBoundaries": "Structured redacted progress events clearly delimit launch, child output, failure, completion, and cancellation states."
  },
  "exactNextAction": "Persist this semanticReview result, then complete the required same-head planReview and mergeRiskReview stages."
}
