{
  "schemaVersion": "1.0.0",
  "taskId": "SUT-AIOS-GOV-057",
  "baseSha": "76f42c6b0d7a292fb1bb251c088c6e3e9db0f6ce",
  "headSha": "4215e5f1eb07b30254500c22303a14f9d0bc5c37",
  "reviewerAgent": "engineering-planner",
  "model": "gpt-5.6-sol",
  "reasoningEffort": "high",
  "contextManifestHash": "6d0779aec17922190cc0f75c6cf3713f67d7ea25b84d801a8f2a7a33f929ebc0",
  "reviewedAt": "2026-08-12T21:18:16.829Z",
  "stage": "planReview",
  "runId": "20260812211801702-8ab1a598",
  "tracePath": "evidence/reviews/SUT-AIOS-GOV-057/traces/20260812211801702-8ab1a598-engineering-planner-sol.jsonl",
  "outputHash": "43e52620880215fa9d2739a5f4775088df859ce9d21e5ed1d8a46a78c3cb95dd",
  "decision": "pass",
  "blockingFindings": [],
  "nonBlockingRisks": [
    "The repair spans launcher execution, cancellation, persistence, schema validation, lifecycle admission, and evidence-chain enforcement; continued stage-specific review is necessary because their shared publication boundary is correctness-sensitive."
  ],
  "missingNegativeTests": [],
  "architectureAssessment": {
    "deepModules": "The plan keeps review orchestration, binding, validation, cancellation, and publication behind the launcher and task lifecycle modules, with explicit invariants and deterministic tests rather than exposing provider or product behavior.",
    "hexagonalArchitecture": "The bounded change preserves the Codex CLI as an adapter behind repository governance and validation boundaries; it introduces no provider fallback, production authority, dependency change, or product-runtime coupling.",
    "eventedBoundaries": "Structured review progress and terminal events have explicit ordering, redaction, cancellation, and persistence invariants, including exactly one successful finish after review binding and fail-closed behavior for every unsuccessful path."
  },
  "exactNextAction": "Run the independent semanticReview stage on immutable head 4215e5f1eb07b30254500c22303a14f9d0bc5c37 using the packet-authorized qa-verification Luna/high route, preserving the exact-head verification and task-bound evidence sequence."
}
