{
  "schemaVersion": "1.0.0",
  "taskId": "SUT-AIOS-GOV-057",
  "baseSha": "76f42c6b0d7a292fb1bb251c088c6e3e9db0f6ce",
  "headSha": "c5331e4cb40e3973ee22d22e3d70aae0986ca17f",
  "reviewerAgent": "engineering-planner",
  "model": "gpt-5.6-sol",
  "reasoningEffort": "high",
  "contextManifestHash": "7ae8fca05c9f6ff34d51e4baf5bf8636d232a43edc6f193d8546fc9354c1b64f",
  "reviewedAt": "2026-08-09T08:16:50.871Z",
  "stage": "planReview",
  "runId": "20260809081629846-f8311f4e",
  "tracePath": "artifacts/traces/codex-routing/SUT-AIOS-GOV-057/20260809081629846-f8311f4e-engineering-planner-sol.jsonl",
  "outputHash": "654493b34a2fbdf5ef0ea8a9f2ab4a79f162349fac71692c425c6d1ca75a9536",
  "decision": "pass",
  "blockingFindings": [],
  "nonBlockingRisks": [
    "Cancellation behavior is platform-sensitive; verification must demonstrate that escalation targets only the spawned Codex child tree and produces exactly one cancelled terminal event without persisting a review artifact."
  ],
  "missingNegativeTests": [],
  "architectureAssessment": {
    "deepModules": "The packet keeps parsing, binding, validation, progress, cancellation, and persistence responsibilities inside the existing review-runner modules with an exact path allowlist and no dependency changes.",
    "hexagonalArchitecture": "The repair preserves the Codex CLI as the existing process adapter while keeping routing policy, schema validation, task lifecycle, and review persistence as separate governed boundaries; no provider fallback or new external adapter is introduced.",
    "eventedBoundaries": "The planned JSONL progress states cover child launch, redacted output counts, completion, failure, cancellation request, escalation, and one terminal cancellation event, with persistence gated behind successful output parsing, binding, and schema validation."
  },
  "exactNextAction": "Proceed with independent semantic review of the committed head c5331e4cb40e3973ee22d22e3d70aae0986ca17f, requiring the packet-listed deterministic evidence for JSON-only rejection, schema rejection before persistence, trace minimisation, terminal failure coverage, child-scoped cancellation, no fallback, and unchanged P3-001 scope."
}
