{
  "schemaVersion": "1.0.0",
  "taskId": "SUT-AIOS-GOV-057",
  "baseSha": "76f42c6b0d7a292fb1bb251c088c6e3e9db0f6ce",
  "headSha": "3fc60e9a2ab00fcd35f10b8e42bc53cd139f5be8",
  "reviewerAgent": "engineering-planner",
  "model": "gpt-5.6-sol",
  "reasoningEffort": "high",
  "contextManifestHash": "477a9a121cb14685753bd73be5846d9c03ba3480e7288e5918ded1c94ab4fa3c",
  "reviewedAt": "2026-08-13T03:39:40.732Z",
  "stage": "planReview",
  "runId": "20260813033924362-a2cb92d6",
  "tracePath": "evidence/reviews/SUT-AIOS-GOV-057/traces/20260813033924362-a2cb92d6-engineering-planner-sol.jsonl",
  "outputHash": "e1459b2b97b2512484a7f7b3b865416746a0624f9a666cc02a5799c8414c9a54",
  "decision": "pass",
  "blockingFindings": [],
  "nonBlockingRisks": [
    "The repair spans launcher process control, evidence publication, lifecycle validation, schema enforcement, and documentation; later semantic and merge-risk reviews must verify that shared final-validation logic has not diverged across the CLI, Codex-app, and direct-persistence adapters.",
    "The extensive same-task revision history increases context and audit complexity, so later stages must remain bound to the immutable source head and exact task-local evidence sequence."
  ],
  "missingNegativeTests": [],
  "architectureAssessment": {
    "deepModules": "The packet assigns review orchestration, strict output validation, trace admission, atomic publication, and lifecycle evidence rules to explicit governed modules with packet-scoped paths and deterministic tests; the plan does not widen product or production authority.",
    "hexagonalArchitecture": "CLI execution, Codex-app preparation, and direct persistence remain adapters around shared review-result, trace, context, and lifecycle validation boundaries; provider fallback, routing authority, and product runtime behavior are explicitly excluded.",
    "eventedBoundaries": "The plan defines ordered start, child-started, bounded progress, review-bound, and singular terminal events, with fail-closed cancellation and persistence occurring only after successful terminal provenance; negative coverage is specified for malformed ordering, stale bindings, cancellation failures, and partial publication."
  },
  "exactNextAction": "Persist this planReview result for source head 3fc60e9a2ab00fcd35f10b8e42bc53cd139f5be8, then run the packet-authorized semanticReview on that same immutable head using qa-verification with luna/high."
}
