{
  "schemaVersion": "1.0.0",
  "taskId": "SUT-AIOS-GOV-057",
  "baseSha": "76f42c6b0d7a292fb1bb251c088c6e3e9db0f6ce",
  "headSha": "baed0a9d72cb71417d8bddde00da8ce792c8fe8c",
  "reviewerAgent": "engineering-planner",
  "model": "gpt-5.6-sol",
  "reasoningEffort": "high",
  "contextManifestHash": "d738eda9533293bdb7744978dd8d4f3b4a22d350a84b9779847c3209ae45d4b3",
  "reviewedAt": "2026-08-09T09:18:43.271Z",
  "stage": "planReview",
  "runId": "20260809091815486-6717e158",
  "tracePath": "artifacts/traces/codex-routing/SUT-AIOS-GOV-057/20260809091815486-6717e158-engineering-planner-sol.jsonl",
  "outputHash": "2e98f7095428fc705a900fbea6096101561c2b87943a45e1444ebd6d5aa1679f",
  "decision": "pass",
  "blockingFindings": [],
  "nonBlockingRisks": [
    "Review stdout is accumulated in memory without an explicit byte ceiling; this is outside the packet's stated acceptance criteria but should be considered in a future bounded hardening task."
  ],
  "missingNegativeTests": [],
  "architectureAssessment": {
    "deepModules": "The plan keeps review prompting, strict assessment parsing, immutable binding, persistence, progress reporting, and cancellation control inside the existing launcher boundary with focused deterministic tests.",
    "hexagonalArchitecture": "The repair preserves the Codex CLI as an existing adapter and does not grant it policy, routing, provider-fallback, deployment, or production authority.",
    "eventedBoundaries": "Structured launch, output-count, completion, failure, cancellation-request, escalation, and terminal events are explicit and redacted, while cancellation remains fail closed and cannot persist a review result without confirmed termination and child close."
  },
  "exactNextAction": "Proceed with the packet-authorized semanticReview on immutable head baed0a9d72cb71417d8bddde00da8ce792c8fe8c using qa-verification on luna/high."
}
