{
  "schemaVersion": "1.0.0",
  "taskId": "SUT-AIOS-GOV-057",
  "baseSha": "76f42c6b0d7a292fb1bb251c088c6e3e9db0f6ce",
  "headSha": "fde14753edd530bee23e2fd3d98887f5b7fcd090",
  "reviewerAgent": "engineering-planner",
  "model": "gpt-5.6-sol",
  "reasoningEffort": "high",
  "contextManifestHash": "d7c4e2722b8dd350f678a7222eb83df2005b378dc2a04f914535960eff87c770",
  "reviewedAt": "2026-08-09T07:57:09.948Z",
  "stage": "planReview",
  "runId": "20260809075633160-93039ff3",
  "tracePath": "artifacts/traces/codex-routing/SUT-AIOS-GOV-057/20260809075633160-93039ff3-engineering-planner-sol.jsonl",
  "outputHash": "eaa3a0c6319648f096cbeaf27d11535962d5e48349481d8dc7522e1efac06fa8",
  "decision": "pass",
  "blockingFindings": [],
  "nonBlockingRisks": [
    "Cancellation behavior is platform-sensitive; verification must demonstrate that escalation targets only the launched Codex child tree and cannot affect unrelated processes.",
    "Progress-event assertions should verify both redaction and exactly one terminal event under child-exit and signal races."
  ],
  "missingNegativeTests": [
    "Repeated SIGINT or SIGTERM does not emit duplicate cancelled terminal events or persist a review artifact.",
    "Cancellation racing with successful child exit still fails closed without partial or duplicate persistence.",
    "Escalation terminates only the launched child tree while an unrelated sibling process remains running.",
    "Empty, malformed, array-valued, multi-value, extra-field, missing-field, and schema-invalid assessment output is rejected before creating a review artifact.",
    "A committed-head or origin/main binding change during review rejects the result before persistence.",
    "Child spawn failure and nonzero exit emit redacted failure progress without persisting review output."
  ],
  "architectureAssessment": {
    "deepModules": "The packet keeps the repair concentrated in the existing launcher boundary with narrowly scoped lifecycle, binding, and validator tests; provider fallback, dependencies, schemas, production code, and P3-001 remain explicitly excluded.",
    "hexagonalArchitecture": "The plan preserves the Codex CLI as an existing external process adapter: governed routing and review-result binding remain inside the launcher, while provider behavior cannot change routing policy or authorize persistence.",
    "eventedBoundaries": "JSONL progress and signal-driven cancellation form explicit local process events with redacted payloads, deterministic terminal states, and persistence allowed only after successful parsing, binding, and schema validation."
  },
  "exactNextAction": "Proceed to independent semanticReview at the same committed head, requiring the packet-listed deterministic tests and the identified cancellation, redaction, malformed-output, and no-persistence negative cases to pass before merge-risk review."
}
