{
  "schemaVersion": "1.0.0",
  "taskId": "SUT-AIOS-GOV-057",
  "baseSha": "76f42c6b0d7a292fb1bb251c088c6e3e9db0f6ce",
  "headSha": "d66988dbd42ab4a0b2cdbda5553ac241e13834d8",
  "reviewerAgent": "engineering-planner",
  "model": "gpt-5.6-sol",
  "reasoningEffort": "high",
  "contextManifestHash": "aa155f2ec6d10ccff68a7245f0b3dc409d0f6a7ead6a3e38d22a4fc06cf64dc4",
  "reviewedAt": "2026-08-09T09:49:16.872Z",
  "stage": "planReview",
  "runId": "20260809094844142-1dd2c2e6",
  "tracePath": "artifacts/traces/codex-routing/SUT-AIOS-GOV-057/20260809094844142-1dd2c2e6-engineering-planner-sol.jsonl",
  "outputHash": "51ddd7915ba4e355e7a721b55ade5f1fec3e435f0ba51e59634ee2e6fd50f154",
  "decision": "pass",
  "blockingFindings": [],
  "nonBlockingRisks": [
    "The 393216-byte task context cap leaves finite headroom below the repository-wide ceiling; additional same-task review history could require another explicitly governed cap decision."
  ],
  "missingNegativeTests": [],
  "architectureAssessment": {
    "deepModules": "The repair remains concentrated in the review launcher and its deterministic validation surfaces, keeping parsing, binding, evidence sequencing, progress reporting, and cancellation behind one governed module boundary.",
    "hexagonalArchitecture": "Provider execution remains an adapter-like child-process boundary; the change does not grant Codex scheduling, policy, deployment, production, or fallback authority and preserves repository evidence as the durable workflow boundary.",
    "eventedBoundaries": "Review progress and terminal outcomes are explicit redacted JSONL events, with cancellation requiring confirmed tree termination and root-child closure before a cancelled terminal state and with failed or cancelled paths prohibited from persisting review results."
  },
  "exactNextAction": "Persist this passing planReview result for head d66988dbd42ab4a0b2cdbda5553ac241e13834d8, then run the packet-authorized semanticReview on that same immutable head using its exact-head verification evidence."
}
