{
  "schemaVersion": "1.0.0",
  "taskId": "SUT-AIOS-GOV-057",
  "baseSha": "76f42c6b0d7a292fb1bb251c088c6e3e9db0f6ce",
  "headSha": "6bd1e9373a4b9f64fc9c632e038cac9166c53ffe",
  "reviewerAgent": "qa-verification",
  "model": "gpt-5.6-luna",
  "reasoningEffort": "high",
  "contextManifestHash": "d498a5852c7bd1f15e957b97ffbcdffc0cacffd20da7ba63c77a6fb07cd4db9d",
  "reviewedAt": "2026-08-13T02:52:03.031Z",
  "stage": "semanticReview",
  "runId": "20260813025048821-85bc74bf",
  "tracePath": "evidence/reviews/SUT-AIOS-GOV-057/traces/20260813025048821-85bc74bf-qa-verification-luna.jsonl",
  "outputHash": "7a4c03787abd75ac24d12bf9586a24200e54d91dd5830b3feb51f1b60c050298",
  "decision": "pass",
  "blockingFindings": [],
  "nonBlockingRisks": [
    "scripts/codex/launch.mjs remains broad and multi-responsibility; future decomposition could improve cohesion without affecting this bounded repair."
  ],
  "missingNegativeTests": [],
  "architectureAssessment": {
    "deepModules": "Explicit helper boundaries preserve the bounded review-runner behavior, though the launcher remains broad rather than deeply modular.",
    "hexagonalArchitecture": "CLI execution, packet/routing authority, validation, and evidence publication remain separated; no production adapter or authority boundary is introduced.",
    "eventedBoundaries": "Child streams, cancellation, progress, terminal state, trace sealing, and atomic publication have explicit fail-closed boundaries."
  },
  "exactNextAction": "Persist this passing semanticReview artifact bound to source head 6bd1e9373a4b9f64fc9c632e038cac9166c53ffe and canonical origin/main, then proceed to mergeRiskReview."
}
