{
  "schemaVersion": "1.0.0",
  "taskId": "SUT-AIOS-GOV-057",
  "baseSha": "76f42c6b0d7a292fb1bb251c088c6e3e9db0f6ce",
  "headSha": "51e0519f1384cacac617d35335046270386e81a0",
  "reviewerAgent": "engineering-planner",
  "model": "gpt-5.6-sol",
  "reasoningEffort": "high",
  "contextManifestHash": "07d6ea2fcc25975898d468906c663a7c678c78c45816a7e66cb88f23d2a6a4a2",
  "reviewedAt": "2026-08-09T09:15:26.159Z",
  "stage": "planReview",
  "runId": "20260809091500895-e25f79cd",
  "tracePath": "artifacts/traces/codex-routing/SUT-AIOS-GOV-057/20260809091500895-e25f79cd-engineering-planner-sol.jsonl",
  "outputHash": "817d214960980d6e7f5b1301d748f242e1fa64cc53b4679a5186baed6f0f71e1",
  "decision": "pass",
  "blockingFindings": [],
  "nonBlockingRisks": [
    "Cancellation behavior is platform-specific and timing-sensitive; deterministic tests should continue to cover late termination failures and child-close ordering on Windows and process-group escalation on POSIX.",
    "The broad task-record glob is acceptable only because the packet simultaneously forbids other-task modification and limits the objective to GOV-057 lifecycle records."
  ],
  "missingNegativeTests": [],
  "architectureAssessment": {
    "deepModules": "The plan keeps review parsing, binding, persistence, progress reporting, and cancellation inside the existing launcher boundary, with focused validators covering its externally observable contract.",
    "hexagonalArchitecture": "Provider and CLI execution remain behind the existing launcher process boundary; the packet prohibits provider changes, fallback, dependency changes, and external mutations.",
    "eventedBoundaries": "The planned JSONL lifecycle has explicit launch, output, completion, failure, cancellation-request, escalation, and terminal outcomes, with cancellation required to fail closed before persistence."
  },
  "exactNextAction": "Accept the plan review and run the packet-authorized semanticReview against committed head 51e0519f1384cacac617d35335046270386e81a0 using qa-verification on luna/high."
}
