{
  "schemaVersion": "1.0.0",
  "taskId": "SUT-AIOS-GOV-057",
  "baseSha": "76f42c6b0d7a292fb1bb251c088c6e3e9db0f6ce",
  "headSha": "baed0a9d72cb71417d8bddde00da8ce792c8fe8c",
  "reviewerAgent": "qa-verification",
  "model": "gpt-5.6-luna",
  "reasoningEffort": "high",
  "contextManifestHash": "e04a8866bba97038524bd26598a95eae7f6a1ea197c42a3dee49060345992593",
  "reviewedAt": "2026-08-09T09:19:42.725Z",
  "stage": "semanticReview",
  "runId": "20260809091847710-6dbb658c",
  "tracePath": "artifacts/traces/codex-routing/SUT-AIOS-GOV-057/20260809091847710-6dbb658c-qa-verification-luna.jsonl",
  "outputHash": "03fed54f497e184c347cfebb21fe7b567413a2f13ee1ba5c9d9a96fe87efa57f",
  "decision": "pass",
  "blockingFindings": [],
  "nonBlockingRisks": [],
  "missingNegativeTests": [],
  "architectureAssessment": {
    "deepModules": "Launcher responsibilities are separated into routing, context construction, assessment parsing, cancellation, terminal-state control, and persistence helpers.",
    "hexagonalArchitecture": "Codex execution, filesystem traces, and review persistence remain explicit adapters around bounded orchestration logic.",
    "eventedBoundaries": "Child lifecycle and cancellation transitions emit redacted structured progress events with fail-closed terminal ordering."
  },
  "exactNextAction": "Persist this semanticReview result and proceed to the required mergeRiskReview stage."
}
