{
  "schemaVersion": "1.0.0",
  "taskId": "SUT-AIOS-GOV-057",
  "baseSha": "76f42c6b0d7a292fb1bb251c088c6e3e9db0f6ce",
  "headSha": "74f221d70e10dc2e5388534d01451a4971fcaba0",
  "reviewerAgent": "engineering-planner",
  "model": "gpt-5.6-sol",
  "reasoningEffort": "high",
  "contextManifestHash": "971c0e3ae1fb85c0bccc0fd557fca2d4bfb54b2d83c64fede19c2f2dcc7b15c7",
  "reviewedAt": "2026-08-12T21:34:30.158Z",
  "stage": "planReview",
  "runId": "20260812213412059-8fbe68b7",
  "tracePath": "evidence/reviews/SUT-AIOS-GOV-057/traces/20260812213412059-8fbe68b7-engineering-planner-sol.jsonl",
  "outputHash": "528bad8483a896c4ec352ff51053c8cce62130f68c6f131d002141d242e54544",
  "decision": "pass",
  "blockingFindings": [],
  "nonBlockingRisks": [
    "The broad historical lifecycle and evidence surface increases review-context pressure, but the current correction remains constrained by the unchanged task-local byte cap and exact path/command allowlists.",
    "Progress coalescing intentionally sacrifices per-chunk observability; cumulative byte milestones and terminal events must remain sufficient for diagnosis without exposing model output."
  ],
  "missingNegativeTests": [],
  "architectureAssessment": {
    "deepModules": "The output-boundary behavior is encapsulated in collectBoundedReviewOutput and appendBoundedReviewOutput, keeping byte accounting, capture limits, and progress coalescing behind a narrow interface with focused deterministic coverage.",
    "hexagonalArchitecture": "The change remains inside the local Codex review adapter and its governance validators; it does not move provider, production, routing, or product authority into the launcher.",
    "eventedBoundaries": "Child-output progress is converted from raw stream-chunk events into deterministic cumulative byte milestones, while overflow, cancellation, failure, review binding, and the single terminal finish remain explicit fail-closed boundaries."
  },
  "exactNextAction": "Run the packet-authorized semanticReview stage with qa-verification on immutable head 74f221d70e10dc2e5388534d01451a4971fcaba0, preserving the exact-head verification record and publishing no merge-risk result until the same-head semantic artifact and bound trace pass validation."
}
